{
    "id": "truthy-falsy-checker-js",
    "title": "Truthy or Falsy?",
    "language": "JavaScript",
    "level": "beginner",
    "tags": ["boolean", "conditionals", "fundamentals"],
    "statement": "Write a function called `checkTruthyFalsy` that takes an array of values and returns a new array where each element is replaced by the string `'truthy'` if the original value evaluates to `true` in a boolean context, or `'falsy'` if it evaluates to `false`.\n\nIn JavaScript, certain values are considered *falsy*: `false`, `0`, `''` (empty string), `null`, `undefined`, and `NaN`. All other values are *truthy*.\n\nYour task is to iterate over the given array and classify each element correctly.",
    "input_format": "An array of values (can include numbers, strings, booleans, null, undefined, or objects).",
    "output_format": "An array of strings where each element is either `'truthy'` or `'falsy'`, corresponding to the input values.",
    "examples": [
      {
        "input": "[0, 1, '', 'hello', null]",
        "output": "['falsy', 'truthy', 'falsy', 'truthy', 'falsy']",
        "explanation": "`0`, `''`, and `null` are falsy; `1` and `'hello'` are truthy."
      },
      {
        "input": "[false, true, undefined]",
        "output": "['falsy', 'truthy', 'falsy']",
        "explanation": "`false` and `undefined` are falsy; `true` is truthy."
      },
      {
        "input": "['0', NaN, {}, []]",
        "output": "['truthy', 'falsy', 'truthy', 'truthy']",
        "explanation": "String `'0'`, empty object `{}`, and empty array `[]` are truthy; `NaN` is falsy."
      }
    ],
    "test_cases": [
      {
        "input": "[0, 1, '', 'hello', null]",
        "expected_output": "['falsy', 'truthy', 'falsy', 'truthy', 'falsy']",
        "weight": 0.4
      },
      {
        "input": "[false, true, undefined]",
        "expected_output": "['falsy', 'truthy', 'falsy']",
        "weight": 0.3
      },
      {
        "input": "['0', NaN, {}, []]",
        "expected_output": "['truthy', 'falsy', 'truthy', 'truthy']",
        "weight": 0.3
      }
    ],
    "reference_solution": {
      "code": "function checkTruthyFalsy(values) {\n  return values.map(v => Boolean(v) ? 'truthy' : 'falsy');\n}",
      "complexity": "O(n)",
      "explanation": "The function uses `Array.map` to iterate over each value and applies the Boolean constructor to determine its truthiness. The result is an array of strings indicating 'truthy' or 'falsy'."
    },
    "common_errors": [
      {
        "pattern": "using == instead of Boolean()",
        "explanation": "Comparing directly with `== true` or `== false` can lead to incorrect results due to type coercion. Use `Boolean(value)` or the double negation `!!value` instead."
      },
      {
        "pattern": "checking only for falsy === false",
        "explanation": "Falsy values include more than just `false` â€” they also include `0`, `''`, `null`, `undefined`, and `NaN`."
      }
    ],
    "feedback": {
      "summary": "You practiced understanding JavaScript's truthy and falsy evaluation.",
      "tips": [
        "Remember which values are falsy: false, 0, '', null, undefined, NaN.",
        "You can test truthiness quickly using Boolean(value) or !!value.",
        "Avoid explicit equality checks when determining truthiness."
      ]
    },
    "metadata": {
      "author": "CodeChallenge Example Generator",
      "license": "CC BY-SA 4.0",
      "created_at": "2025-10-14T00:00:00Z"
    }
  }
  